{
  "$schema": "./brep-capability-qualification-plan-v2.schema.json",
  "schema": "open-scad-viewer/brep-capability-qualification-plan",
  "schemaVersion": 2,
  "planId": "certified-mass-properties-1",
  "gate": {
    "id": "g8-full",
    "name": "brep-full-closed-matrix",
    "version": 2
  },
  "lifecycle": {
    "status": "qualified",
    "qualificationClaim": "qualified"
  },
  "claimBoundary": {
    "candidateClaim": "Qualified finite cell for certified-mass-properties/1: Audited exact axis-aligned or rigidly placed boxes, cylinders, tubes, and planar exact-profile prisms",
    "forbiddenClaims": [
      "Spheres, tori, cones, and generic freeform solids",
      "Quadrature estimates relabeled as certified",
      "Incomplete naming evidence"
    ]
  },
  "capability": "certified-mass-properties/1",
  "dependencies": [
    {
      "capability": "numeric-evidence-curved-brep/1",
      "requiredMaturity": "Qualified"
    },
    {
      "capability": "global-solid-audit/1",
      "requiredMaturity": "Qualified"
    },
    {
      "capability": "persistent-naming/1",
      "requiredMaturity": "Qualified"
    }
  ],
  "scope": {
    "included": [
      "Audited exact axis-aligned or rigidly placed boxes, cylinders, tubes, and planar exact-profile prisms",
      "Finite interval enclosures for area, volume, centroid, and inertia"
    ],
    "excluded": [
      "Spheres, tori, cones, and generic freeform solids",
      "Quadrature estimates relabeled as certified",
      "Incomplete naming evidence"
    ]
  },
  "matrix": [
    {
      "id": "MASS-BOX",
      "expected": "Complete",
      "blocksQualification": true
    },
    {
      "id": "MASS-CYLINDER",
      "expected": "Complete",
      "blocksQualification": true
    },
    {
      "id": "MASS-TUBE",
      "expected": "Complete",
      "blocksQualification": true
    },
    {
      "id": "MASS-PROFILE-PRISM",
      "expected": "Complete",
      "blocksQualification": true
    },
    {
      "id": "MASS-RIGID-SCALE",
      "expected": "Complete",
      "blocksQualification": true
    },
    {
      "id": "MASS-SPHERE",
      "expected": "typed-refuse",
      "blocksQualification": true
    },
    {
      "id": "MASS-NAMING-MUTATION",
      "expected": "typed-refuse",
      "blocksQualification": true
    }
  ],
  "bindings": {
    "implementation": [
      "crates/brep-core/src/analysis.rs",
      "crates/geometry-bridge/src/lib.rs",
      "src/services/geometry/brep.ts"
    ],
    "registry": "src/services/geometry/brepCapability.ts",
    "evidenceJson": "docs/qualification/certified-mass-properties-1-evidence-v2.json"
  },
  "evidence": {
    "state": "qualified",
    "notes": [
      "Native, bridge certificate, and product WASM rows passed on the recorded source-bound run.",
      "Every excluded row remains typed-refuse; no external clean-run claim is made."
    ]
  },
  "resetPolicy": "false-Complete freezes this capability and transitively stales all dependents; recovery requires a successor capability ID",
  "unresolvedRows": []
}
